{
  "$comment": "GENERATED BY tools/schemagen — DO NOT HAND EDIT",
  "$id": "urn:nself:cli:schema:catalog:v1",
  "$schema": "https://json-schema.org/draft/2020-12/schema",
  "additionalProperties": false,
  "description": "Plugin catalog (contract plugins.catalog v1): one row per slug and tier, bundles and counts. Generated by tools/catalog.",
  "properties": {
    "_generated": {
      "type": "string"
    },
    "bundles": {
      "additionalProperties": {
        "additionalProperties": false,
        "properties": {
          "display": {
            "type": "string"
          },
          "plugins": {
            "items": {
              "type": "string"
            },
            "type": "array"
          },
          "tier": {
            "enum": [
              "free",
              "licensed"
            ],
            "type": "string"
          }
        },
        "required": [
          "display",
          "tier",
          "plugins"
        ],
        "type": "object"
      },
      "type": "object"
    },
    "counts": {
      "additionalProperties": false,
      "properties": {
        "_generated": {
          "type": "string"
        },
        "advertised": {
          "type": "integer"
        },
        "free": {
          "additionalProperties": false,
          "properties": {
            "entries": {
              "type": "integer"
            },
            "installable": {
              "type": "integer"
            },
            "nonInstallable": {
              "items": {
                "type": "string"
              },
              "type": "array"
            }
          },
          "required": [
            "entries",
            "installable",
            "nonInstallable"
          ],
          "type": "object"
        },
        "generated_from": {
          "additionalProperties": false,
          "properties": {
            "bundles_ref": {
              "type": "string"
            },
            "generated_at": {
              "type": "string"
            },
            "plugins_ref": {
              "type": "string"
            }
          },
          "required": [
            "plugins_ref",
            "bundles_ref",
            "generated_at"
          ],
          "type": "object"
        },
        "overlap": {
          "additionalProperties": false,
          "properties": {
            "duplicates": {
              "items": {
                "type": "string"
              },
              "type": "array"
            },
            "sharedSlugs": {
              "items": {
                "type": "string"
              },
              "type": "array"
            },
            "tierPairs": {
              "items": {
                "type": "string"
              },
              "type": "array"
            }
          },
          "required": [
            "sharedSlugs",
            "tierPairs",
            "duplicates"
          ],
          "type": "object"
        },
        "pro": {
          "additionalProperties": false,
          "properties": {
            "entries": {
              "type": "integer"
            },
            "installable": {
              "type": "integer"
            },
            "nonInstallable": {
              "items": {
                "type": "string"
              },
              "type": "array"
            }
          },
          "required": [
            "entries",
            "installable",
            "nonInstallable"
          ],
          "type": "object"
        },
        "schema_version": {
          "const": 1,
          "type": "integer"
        },
        "totals": {
          "additionalProperties": false,
          "properties": {
            "entries": {
              "type": "integer"
            },
            "installable": {
              "type": "integer"
            }
          },
          "required": [
            "entries",
            "installable"
          ],
          "type": "object"
        }
      },
      "required": [
        "_generated",
        "schema_version",
        "generated_from",
        "free",
        "pro",
        "overlap",
        "totals",
        "advertised"
      ],
      "type": "object"
    },
    "generated_from": {
      "additionalProperties": false,
      "properties": {
        "bundles_ref": {
          "type": "string"
        },
        "generated_at": {
          "type": "string"
        },
        "plugins_ref": {
          "type": "string"
        }
      },
      "required": [
        "plugins_ref",
        "bundles_ref",
        "generated_at"
      ],
      "type": "object"
    },
    "plugins": {
      "items": {
        "additionalProperties": false,
        "properties": {
          "bundles": {
            "items": {
              "type": "string"
            },
            "type": "array"
          },
          "category": {
            "type": "string"
          },
          "checksum": {
            "pattern": "^[0-9a-f]{64}$",
            "type": "string"
          },
          "commands": {
            "additionalProperties": false,
            "properties": {
              "command": {
                "type": "string"
              },
              "subcommands": {
                "items": {
                  "type": "string"
                },
                "type": "array"
              }
            },
            "required": [
              "command",
              "subcommands"
            ],
            "type": [
              "null",
              "object"
            ]
          },
          "description": {
            "type": "string"
          },
          "docs_url": {
            "type": [
              "null",
              "string"
            ]
          },
          "installable": {
            "type": "boolean"
          },
          "maturity": {
            "enum": [
              "implemented",
              "experimental",
              "scaffolded",
              "planned",
              "deferred"
            ],
            "type": "string"
          },
          "platform_signatures": {
            "additionalProperties": {
              "additionalProperties": false,
              "properties": {
                "alg": {
                  "const": "ed25519",
                  "type": "string"
                },
                "key_id": {
                  "type": "string"
                },
                "sig": {
                  "type": "string"
                }
              },
              "required": [
                "key_id",
                "alg",
                "sig"
              ],
              "type": "object"
            },
            "propertyNames": {
              "enum": [
                "darwin-amd64",
                "darwin-arm64",
                "linux-amd64",
                "linux-arm64",
                "windows-amd64"
              ]
            },
            "type": "object"
          },
          "release_signature": {
            "additionalProperties": false,
            "properties": {
              "alg": {
                "const": "ed25519",
                "type": "string"
              },
              "key_id": {
                "type": "string"
              },
              "sig": {
                "type": "string"
              }
            },
            "required": [
              "key_id",
              "alg",
              "sig"
            ],
            "type": [
              "null",
              "object"
            ]
          },
          "requires": {
            "additionalProperties": false,
            "properties": {
              "nself": {
                "type": "string"
              },
              "plugins": {
                "items": {
                  "type": "string"
                },
                "type": "array"
              },
              "postgres_extensions": {
                "items": {
                  "type": "string"
                },
                "type": "array"
              }
            },
            "type": [
              "null",
              "object"
            ]
          },
          "schema": {
            "type": [
              "null",
              "string"
            ]
          },
          "service_kind": {
            "enum": [
              "compose",
              "cli",
              "library"
            ],
            "type": "string"
          },
          "slug": {
            "type": "string"
          },
          "tarball_url": {
            "type": "string"
          },
          "tier": {
            "enum": [
              "free",
              "licensed"
            ],
            "type": "string"
          },
          "tier_pair": {
            "type": "boolean"
          },
          "version": {
            "type": "string"
          }
        },
        "required": [
          "slug",
          "tier",
          "version",
          "description",
          "category",
          "maturity",
          "installable",
          "service_kind",
          "commands",
          "schema",
          "requires",
          "docs_url",
          "bundles",
          "tier_pair",
          "checksum",
          "release_signature",
          "tarball_url"
        ],
        "type": "object"
      },
      "type": "array"
    },
    "schema_version": {
      "const": 1,
      "type": "integer"
    }
  },
  "required": [
    "_generated",
    "schema_version",
    "generated_from",
    "plugins",
    "bundles",
    "counts"
  ],
  "type": "object"
}
