{
  "_generated": "GENERATED BY tools/catalog — DO NOT HAND EDIT",
  "bundles": {
    "claw": {
      "display": "Claw Bundle",
      "plugins": [
        "claw",
        "cron"
      ],
      "tier": "licensed"
    },
    "task": {
      "display": "Task Bundle",
      "plugins": [
        "search",
        "webhooks"
      ],
      "tier": "free"
    }
  },
  "counts": {
    "_generated": "GENERATED BY tools/catalog — DO NOT HAND EDIT",
    "advertised": 15,
    "free": {
      "entries": 14,
      "installable": 13,
      "nonInstallable": [
        "shared-utils"
      ]
    },
    "generated_from": {
      "bundles_ref": "bundles@fixture",
      "generated_at": "2026-10-05T00:00:00Z",
      "plugins_ref": "plugins@fixture"
    },
    "overlap": {
      "duplicates": [
        "cron"
      ],
      "sharedSlugs": [
        "cron"
      ],
      "tierPairs": [
        "cron"
      ]
    },
    "pro": {
      "entries": 3,
      "installable": 3,
      "nonInstallable": []
    },
    "schema_version": 1,
    "totals": {
      "entries": 16,
      "installable": 15
    }
  },
  "generated_from": {
    "bundles_ref": "bundles@fixture",
    "generated_at": "2026-10-05T00:00:00Z",
    "plugins_ref": "plugins@fixture"
  },
  "plugins": [
    {
      "bundles": [],
      "category": "automation",
      "checksum": "e2964b8879a049798f21a6786005e2c97742cdb2db1aadfe3a1ccc0387865b3e",
      "commands": {
        "command": "ai-cli",
        "subcommands": []
      },
      "description": "AI operations for nSelf: chat, local Ollama model management, and Gemini API key pool provisioning and rotation.",
      "docs_url": null,
      "installable": true,
      "maturity": "implemented",
      "release_signature": null,
      "requires": {
        "nself": ">=1.2.8"
      },
      "schema": null,
      "service_kind": "cli",
      "slug": "ai-cli",
      "tarball_url": "https://github.com/nself-org/plugins/releases/download/v1.2.6/ai-cli-1.2.6.tar.gz",
      "tier": "free",
      "tier_pair": false,
      "version": "1.2.6"
    },
    {
      "bundles": [
        "claw"
      ],
      "category": "infrastructure",
      "checksum": "0101010101010101010101010101010101010101010101010101010101010101",
      "commands": null,
      "description": "Assistant runtime (synthetic fixture, not a real manifest).",
      "docs_url": null,
      "installable": true,
      "maturity": "implemented",
      "release_signature": null,
      "requires": {
        "nself": ">=0.9.9"
      },
      "schema": "np_claw",
      "service_kind": "compose",
      "slug": "claw",
      "tarball_url": "https://ping.nself.org/plugins/claw/download",
      "tier": "licensed",
      "tier_pair": false,
      "version": "1.1.2"
    },
    {
      "bundles": [],
      "category": "media",
      "checksum": "e46fd6c617e6fc5347458cc901b6f2ac79da7fa71f7067e72e9f0b115ef64061",
      "commands": null,
      "description": "Content acquisition with download rules engine. Planned: RSS feed monitoring, release calendar integration, automated download orchestration",
      "docs_url": null,
      "installable": true,
      "maturity": "implemented",
      "release_signature": null,
      "requires": {
        "nself": ">=1.0.0"
      },
      "schema": "np_content_acquisition",
      "service_kind": "compose",
      "slug": "content-acquisition",
      "tarball_url": "https://github.com/nself-org/plugins/releases/download/v1.2.6/content-acquisition-1.2.6.tar.gz",
      "tier": "free",
      "tier_pair": false,
      "version": "1.2.6"
    },
    {
      "bundles": [],
      "category": "automation",
      "checksum": "4c762dd8f05cd330b9547b1d8b688f5fc36ee94bbec2681fd1f33c81e1701566",
      "commands": null,
      "description": "Cron job scheduler. Register jobs with standard cron syntax, execute via HTTP callbacks, track run history.",
      "docs_url": null,
      "installable": true,
      "maturity": "implemented",
      "release_signature": null,
      "requires": {
        "nself": ">=0.9.9"
      },
      "schema": "np_cron",
      "service_kind": "compose",
      "slug": "cron",
      "tarball_url": "https://github.com/nself-org/plugins/releases/download/v1.2.6/cron-1.2.6.tar.gz",
      "tier": "free",
      "tier_pair": true,
      "version": "1.2.6"
    },
    {
      "bundles": [
        "claw"
      ],
      "category": "automation",
      "checksum": "0202020202020202020202020202020202020202020202020202020202020202",
      "commands": null,
      "description": "Scheduled jobs with retries (licensed tier of the cron product; synthetic fixture).",
      "docs_url": null,
      "installable": true,
      "maturity": "implemented",
      "release_signature": null,
      "requires": {
        "nself": ">=0.9.9"
      },
      "schema": "np_cron",
      "service_kind": "compose",
      "slug": "cron",
      "tarball_url": "https://ping.nself.org/plugins/cron/download",
      "tier": "licensed",
      "tier_pair": true,
      "version": "1.1.2"
    },
    {
      "bundles": [],
      "category": "compliance",
      "checksum": "0d82c1941016675e01b72a4f95c0cc5196960a34022bcb211a662053eaa1c4ae",
      "commands": {
        "command": "encryption",
        "subcommands": []
      },
      "description": "Bring Your Own Key (BYOK) per-tenant envelope encryption for nSelf Cloud: AWS KMS, GCP Cloud KMS, and HashiCorp Vault Transit, with key rotation and an audit trail.",
      "docs_url": null,
      "installable": true,
      "maturity": "implemented",
      "release_signature": null,
      "requires": {
        "nself": ">=1.2.8"
      },
      "schema": null,
      "service_kind": "cli",
      "slug": "encryption",
      "tarball_url": "https://github.com/nself-org/plugins/releases/download/v1.2.6/encryption-1.2.6.tar.gz",
      "tier": "free",
      "tier_pair": false,
      "version": "1.2.6"
    },
    {
      "bundles": [],
      "category": "communication",
      "checksum": "62a41d8c670e3625d20a75b5d33ed71b258f0e9af69ad2fd878322facb308902",
      "commands": {
        "command": "mail",
        "subcommands": []
      },
      "description": "Send transactional and broadcast email through the nSelf stack: mux + Postmark pipeline via ping_api, template management, and DKIM verification.",
      "docs_url": null,
      "installable": true,
      "maturity": "implemented",
      "release_signature": null,
      "requires": {
        "nself": ">=1.2.8"
      },
      "schema": null,
      "service_kind": "cli",
      "slug": "mail",
      "tarball_url": "https://github.com/nself-org/plugins/releases/download/v1.2.6/mail-1.2.6.tar.gz",
      "tier": "free",
      "tier_pair": false,
      "version": "1.2.6"
    },
    {
      "bundles": [],
      "category": "compliance",
      "checksum": "643a7b8aa09033fa6c9407d5d51d610994c7abf37c5f51d2d7f451e66ed4feaf",
      "commands": {
        "command": "pentest-kit",
        "subcommands": []
      },
      "description": "CLI front end for the pentest plugin: generate scope documents, provision test credentials, import findings, and check remediation status. Business+ tier.",
      "docs_url": null,
      "installable": true,
      "maturity": "implemented",
      "release_signature": null,
      "requires": {
        "nself": ">=1.2.8"
      },
      "schema": null,
      "service_kind": "cli",
      "slug": "pentest-kit",
      "tarball_url": "https://github.com/nself-org/plugins/releases/download/v1.2.6/pentest-kit-1.2.6.tar.gz",
      "tier": "free",
      "tier_pair": false,
      "version": "1.2.6"
    },
    {
      "bundles": [],
      "category": "infrastructure",
      "checksum": "0303030303030303030303030303030303030303030303030303030303030303",
      "commands": null,
      "description": "Realtime server (synthetic licensed fixture).",
      "docs_url": null,
      "installable": true,
      "maturity": "implemented",
      "release_signature": null,
      "requires": {
        "nself": ">=0.9.9"
      },
      "schema": "np_realtime",
      "service_kind": "compose",
      "slug": "realtime",
      "tarball_url": "https://ping.nself.org/plugins/realtime/download",
      "tier": "licensed",
      "tier_pair": false,
      "version": "1.1.2"
    },
    {
      "bundles": [],
      "category": "media",
      "checksum": "7bc363ad1b2cc0920d15bad65d5a19ec5279e98333042c1286b951daae7cd365",
      "commands": null,
      "description": "Retro gaming ROM library management, emulator core serving, save state synchronization, play sessions, and controller configuration for nself-tv",
      "docs_url": null,
      "installable": true,
      "maturity": "implemented",
      "release_signature": null,
      "requires": {
        "nself": ">=1.0.0"
      },
      "schema": "np_retro_gaming",
      "service_kind": "compose",
      "slug": "retro-gaming",
      "tarball_url": "https://github.com/nself-org/plugins/releases/download/v1.2.6/retro-gaming-1.2.6.tar.gz",
      "tier": "free",
      "tier_pair": false,
      "version": "1.2.6"
    },
    {
      "bundles": [
        "task"
      ],
      "category": "infrastructure",
      "checksum": "dcaccbc59393a4970deaec123a43999f6ad2b089c6b02146803490a10c4b402b",
      "commands": null,
      "description": "Full-text search engine with PostgreSQL FTS and MeiliSearch support",
      "docs_url": null,
      "installable": true,
      "maturity": "implemented",
      "release_signature": {
        "alg": "ed25519",
        "key_id": "free-test-1",
        "sig": "c2lnbmF0dXJlLWZvci10ZXN0cy1vbmx5"
      },
      "requires": {
        "nself": ">=0.9.9"
      },
      "schema": "np_search",
      "service_kind": "compose",
      "slug": "search",
      "tarball_url": "https://github.com/nself-org/plugins/releases/download/v1.2.6/search-1.2.6.tar.gz",
      "tier": "free",
      "tier_pair": false,
      "version": "1.2.6"
    },
    {
      "bundles": [],
      "category": "infrastructure",